12:25:56.665749 IP arnab-lappy.54874 > whatsapp-cdn-shv-02-bom1.fbcdn.net.https: Flags [P.], seq 822711360:822711391, ack 3303560239, win 1602, options [nop,nop,TS val 3048029395 ecr 3009216618], length 31
12:25:56.834644 IP whatsapp-cdn-shv-02-bom1.fbcdn.net.https > arnab-lappy.54874: Flags [.], ack 31, win 408, options [nop,nop,TS val 3009242374 ecr 3048029395], length 0
12:25:57.103374 IP whatsapp-cdn-shv-02-bom1.fbcdn.net.https > arnab-lappy.54874: Flags [P.], seq 1:39, ack 31, win 408, options [nop,nop,TS val 3009242622 ecr 3048029395], length 38
12:25:57.103413 IP arnab-lappy.54874 > whatsapp-cdn-shv-02-bom1.fbcdn.net.https: Flags [.], ack 39, win 1602, options [nop,nop,TS val 3048029833 ecr 3009242622], length 0
12:25:57.160450 IP arnab-lappy.57050 > bom12s03-in-f10.1e100.net.http: Flags [P.], seq 3866730990:3866731453, ack 3797840623, win 501, options [nop,nop,TS val 149747717 ecr 1008291843], length 463: HTTP: GET /maps/api/js/AuthenticationService.Authenticate?1shttp%3A%2F%2Fwww.poolprop.com%2F&5shttp%3A%2F%2Fwww.poolprop.com%2F&callback=_xdc_._vyy0jt&token=90832 HTTP/1.1
12:25:57.310374 IP bom12s03-in-f10.1e100.net.http > arnab-lappy.57050: Flags [.], ack 463, win 244, options [nop,nop,TS val 1008332386 ecr 149747717], length 0
12:25:57.310384 IP bom12s03-in-f10.1e100.net.http > arnab-lappy.57050: Flags [P.], seq 1:438, ack 463, win 244, options [nop,nop,TS val 1008332449 ecr 149747717], length 437: HTTP: HTTP/1.1 200 OK
12:25:57.310392 IP arnab-lappy.57050 > bom12s03-in-f10.1e100.net.http: Flags [.], ack 438, win 501, options [nop,nop,TS val 149747906 ecr 1008332449], length 0
12:25:57.365191 IP arnab-lappy.52633 > _gateway.domain: 52180+ [1au] PTR? 104.0.168.192.in-addr.arpa. (55)
12:25:57.469437 IP _gateway.domain > arnab-lappy.52633: 52180 NXDomain 0/0/1 (55)
12:25:57.469530 IP arnab-lappy.52633 > _gateway.domain: 52180+ PTR? 104.0.168.192.in-addr.arpa. (44)
12:25:57.618883 IP _gateway.domain > arnab-lappy.52633: 52180 NXDomain 0/0/0 (44)
12:25:58.459683 IP arnab-lappy.54868 > _gateway.domain: 43315+ [1au] PTR? 1.0.168.192.in-addr.arpa. (53)
12:25:58.668823 IP _gateway.domain > arnab-lappy.54868: 43315 NXDomain 0/0/1 (53)
12:25:58.669191 IP arnab-lappy.54868 > _gateway.domain: 43315+ PTR? 1.0.168.192.in-addr.arpa. (42)
12:25:58.876456 IP _gateway.domain > arnab-lappy.54868: 43315 NXDomain 0/0/0 (42)
12:26:01.559699 IP arnab-lappy.42333 > sc-in-f189.1e100.net.443: UDP, length 23
12:26:01.766158 IP arnab-lappy.41924 > ec2-3-6-207-117.ap-south-1.compute.amazonaws.com.https: Flags [P.], seq 684402946:684403002, ack 2534496628, win 501, options [nop,nop,TS val 3936745043 ecr 154644983], length 56
12:26:01.770445 IP sc-in-f189.1e100.net.443 > arnab-lappy.42333: UDP, length 22
12:26:01.975483 IP ec2-3-6-207-117.ap-south-1.compute.amazonaws.com.https > arnab-lappy.41924: Flags [P.], seq 1:57, ack 56, win 9, options [nop,nop,TS val 154647508 ecr 3936745043], length 56
12:26:01.975518 IP arnab-lappy.41924 > ec2-3-6-207-117.ap-south-1.compute.amazonaws.com.https: Flags [.], ack 57, win 501, options [nop,nop,TS val 3936745352 ecr 154647508], length 0
12:26:02.592443 IP arnab-lappy.58413 > _gateway.domain: 16333+ [1au] PTR? 117.207.6.3.in-addr.arpa. (53)
12:26:02.802423 IP _gateway.domain > arnab-lappy.58413: 16333 1/0/1 PTR ec2-3-6-207-117.ap-south-1.compute.amazonaws.com. (115)
12:26:03.715334 IP arnab-lappy.57876 > sc-in-f188.1e100.net.https: Flags [.], ack 1138561156, win 501, options [nop,nop,TS val 2815260981 ecr 1948106865], length 0
12:26:03.731374 IP arnab-lappy.36122 > bom05s10-in-f142.1e100.net.http: Flags [.], ack 1650495211, win 501, options [nop,nop,TS val 3031396806 ecr 2258812622], length 0
12:26:03.793029 IP bom05s10-in-f142.1e100.net.http > arnab-lappy.36122: Flags [.], ack 1, win 246, options [nop,nop,TS val 2258857685 ecr 3031215117], length 0
12:26:03.825253 IP sc-in-f188.1e100.net.https > arnab-lappy.57876: Flags [.], ack 1, win 274, options [nop,nop,TS val 1948153909 ecr 2814755136], length 0
12:26:03.827322 IP arnab-lappy.41506 > 151.101.193.140.https: Flags [.], ack 3637946249, win 501, options [nop,nop,TS val 2754018609 ecr 4084547833], length 0
12:26:03.845274 IP arnab-lappy.54638 > bom07s15-in-f14.1e100.net.443: UDP, length 1350
12:26:03.845332 IP arnab-lappy.54638 > bom07s15-in-f14.1e100.net.443: UDP, length 375
12:26:03.915296 IP bom07s15-in-f14.1e100.net.443 > arnab-lappy.54638: UDP, length 20
12:26:03.991284 IP 151.101.193.140.https > arnab-lappy.41506: Flags [.], ack 1, win 61, options [nop,nop,TS val 4084559124 ecr 2753651018], length 0
12:26:04.073366 IP bom07s15-in-f14.1e100.net.443 > arnab-lappy.54638: UDP, length 77
12:26:04.076438 IP bom07s15-in-f14.1e100.net.443 > arnab-lappy.54638: UDP, length 376
12:26:04.076714 IP arnab-lappy.54638 > bom07s15-in-f14.1e100.net.443: UDP, length 28
12:26:04.077710 IP bom07s15-in-f14.1e100.net.443 > arnab-lappy.54638: UDP, length 28
12:26:04.077730 IP bom07s15-in-f14.1e100.net.443 > arnab-lappy.54638: UDP, length 226
12:26:04.077917 IP arnab-lappy.54638 > bom07s15-in-f14.1e100.net.443: UDP, length 28
12:26:04.143744 IP 13.107.42.14.https > arnab-lappy.58180: Flags [P.], seq 2973759929:2973760021, ack 3549661540, win 2052, length 92
12:26:04.143771 IP arnab-lappy.58180 > 13.107.42.14.https: Flags [.], ack 92, win 569, length 0
12:26:04.523010 IP arnab-lappy.48065 > _gateway.domain: 21964+ [1au] PTR? 14.42.107.13.in-addr.arpa. (54)
12:26:04.578464 IP _gateway.domain > arnab-lappy.48065: 21964 NXDomain 0/1/1 (140)
12:26:04.578681 IP arnab-lappy.48065 > _gateway.domain: 21964+ PTR? 14.42.107.13.in-addr.arpa. (43)
12:26:04.648357 IP _gateway.domain > arnab-lappy.48065: 21964 NXDomain 0/1/0 (129)
12:26:05.260758 IP 151.101.1.69.https > arnab-lappy.58638: Flags [P.], seq 3591362504:3591362562, ack 2373806852, win 84, options [nop,nop,TS val 386703162 ecr 971884210], length 58
12:26:05.260786 IP 151.101.1.69.https > arnab-lappy.58638: Flags [F.], seq 58, ack 1, win 84, options [nop,nop,TS val 386703163 ecr 971884210], length 0
12:26:05.260794 IP 151.101.1.69.https > arnab-lappy.58638: Flags [F.], seq 58, ack 1, win 84, options [nop,nop,TS val 386703202 ecr 971884210], length 0
12:26:05.260809 IP arnab-lappy.58638 > 151.101.1.69.https: Flags [.], ack 59, win 732, options [nop,nop,TS val 972494403 ecr 386703162,nop,nop,sack 1 {58:59}], length 0
12:26:05.261054 IP arnab-lappy.58638 > 151.101.1.69.https: Flags [F.], seq 1, ack 59, win 732, options [nop,nop,TS val 972494403 ecr 386703162], length 0
12:26:05.311464 IP 151.101.1.69.https > arnab-lappy.58638: Flags [.], ack 2, win 84, options [nop,nop,TS val 386703224 ecr 972494403], length 0
12:26:05.568546 IP kul01s09-in-f78.1e100.net.443 > arnab-lappy.34251: UDP, length 42
12:26:05.585015 IP arnab-lappy.34251 > kul01s09-in-f78.1e100.net.443: UDP, length 29
12:26:05.683274 IP arnab-lappy.52478 > _gateway.domain: 47011+ [1au] A? internshala.com. (44)
12:26:05.707498 IP arnab-lappy.37742 > 27.254.63.94.http: Flags [F.], seq 1814130590, ack 1132657787, win 502, options [nop,nop,TS val 4005854025 ecr 588902814], length 0
12:26:05.708033 IP arnab-lappy.47502 > _gateway.domain: 60986+ [1au] A? users.quantumgraph.com. (51)
12:26:05.733394 IP _gateway.domain > arnab-lappy.52478: 47011 3/0/1 A 3.7.222.182, A 13.127.25.52, A 13.126.14.55 (92)
12:26:05.733836 IP arnab-lappy.46036 > ec2-3-7-222-182.ap-south-1.compute.amazonaws.com.https: Flags [S], seq 4142966576, win 64240, options [mss 1460,sackOK,TS val 1682790685 ecr 0,nop,wscale 7], length 0
12:26:05.758350 IP _gateway.domain > arnab-lappy.47502: 60986 8/0/1 A 54.179.187.46, A 52.74.202.222, A 13.228.131.168, A 52.76.48.203, A 52.77.37.251, A 18.138.44.146, A 54.251.141.203, A 54.251.190.99 (179)
12:26:05.759097 IP arnab-lappy.59086 > ec2-54-179-187-46.ap-southeast-1.compute.amazonaws.com.https: Flags [S], seq 815449549, win 64240, options [mss 1460,sackOK,TS val 4234161575 ecr 0,nop,wscale 7], length 0
12:26:05.763373 IP arnab-lappy.41486 > 151.101.193.140.https: Flags [.], ack 2671017552, win 501, options [nop,nop,TS val 2754020544 ecr 1361345750], length 0
12:26:05.763389 IP arnab-lappy.41456 > 151.101.193.140.https: Flags [.], ack 3004476455, win 2367, options [nop,nop,TS val 2754020544 ecr 1361345749], length 0
12:26:05.763395 IP arnab-lappy.41450 > 151.101.193.140.https: Flags [.], ack 3093750879, win 10825, options [nop,nop,TS val 2754020545 ecr 523695229], length 0
12:26:05.784627 IP ec2-3-7-222-182.ap-south-1.compute.amazonaws.com.https > arnab-lappy.46036: Flags [S.], seq 1983730738, ack 4142966577, win 26847, options [mss 1440,sackOK,TS val 92268524 ecr 1682790685,nop,wscale 8], length 0
12:26:05.784685 IP arnab-lappy.46036 > ec2-3-7-222-182.ap-south-1.compute.amazonaws.com.https: Flags [.], ack 1, win 502, options [nop,nop,TS val 1682790736 ecr 92268524], length 0
12:26:05.785063 IP arnab-lappy.46036 > ec2-3-7-222-182.ap-south-1.compute.amazonaws.com.https: Flags [P.], seq 1:518, ack 1, win 502, options [nop,nop,TS val 1682790736 ecr 92268524], length 517
12:26:05.802457 IP arnab-lappy.33927 > bom07s15-in-f14.1e100.net.443: UDP, length 23
12:26:05.836015 IP ec2-3-7-222-182.ap-south-1.compute.amazonaws.com.https > arnab-lappy.46036: Flags [.], ack 518, win 110, options [nop,nop,TS val 92268537 ecr 1682790736], length 0
12:26:05.837735 IP ec2-3-7-222-182.ap-south-1.compute.amazonaws.com.https > arnab-lappy.46036: Flags [.], seq 1:2857, ack 518, win 110, options [nop,nop,TS val 92268538 ecr 1682790736], length 2856
12:26:05.837767 IP arnab-lappy.46036 > ec2-3-7-222-182.ap-south-1.compute.amazonaws.com.https: Flags [.], ack 2857, win 493, options [nop,nop,TS val 1682790789 ecr 92268538], length 0
12:26:05.838218 IP ec2-3-7-222-182.ap-south-1.compute.amazonaws.com.https > arnab-lappy.46036: Flags [P.], seq 2857:5264, ack 518, win 110, options [nop,nop,TS val 92268538 ecr 1682790736], length 2407
12:26:05.838238 IP arnab-lappy.46036 > ec2-3-7-222-182.ap-south-1.compute.amazonaws.com.https: Flags [.], ack 5264, win 493, options [nop,nop,TS val 1682790789 ecr 92268538], length 0
12:26:05.841211 IP arnab-lappy.46036 > ec2-3-7-222-182.ap-south-1.compute.amazonaws.com.https: Flags [P.], seq 518:644, ack 5264, win 501, options [nop,nop,TS val 1682790792 ecr 92268538], length 126
12:26:05.847809 IP ec2-54-179-187-46.ap-southeast-1.compute.amazonaws.com.https > arnab-lappy.59086: Flags [S.], seq 2188535058, ack 815449550, win 26847, options [mss 1440,sackOK,TS val 318845737 ecr 4234161575,nop,wscale 8], length 0
12:26:05.847867 IP arnab-lappy.59086 > ec2-54-179-187-46.ap-southeast-1.compute.amazonaws.com.https: Flags [.], ack 1, win 502, options [nop,nop,TS val 4234161664 ecr 318845737], length 0
12:26:05.848295 IP arnab-lappy.59086 > ec2-54-179-187-46.ap-southeast-1.compute.amazonaws.com.https: Flags [P.], seq 1:524, ack 1, win 502, options [nop,nop,TS val 4234161664 ecr 318845737], length 523
12:26:05.891178 IP ec2-3-7-222-182.ap-south-1.compute.amazonaws.com.https > arnab-lappy.46036: Flags [P.], seq 5264:5522, ack 644, win 110, options [nop,nop,TS val 92268551 ecr 1682790792], length 258
12:26:05.891480 IP bom07s15-in-f14.1e100.net.443 > arnab-lappy.33927: UDP, length 20
12:26:05.891931 IP arnab-lappy.46036 > ec2-3-7-222-182.ap-south-1.compute.amazonaws.com.https: Flags [.], seq 644:2072, ack 5522, win 501, options [nop,nop,TS val 1682790843 ecr 92268551], length 1428
12:26:05.895207 IP arnab-lappy.46036 > ec2-3-7-222-182.ap-south-1.compute.amazonaws.com.https: Flags [P.], seq 2072:3049, ack 5522, win 501, options [nop,nop,TS val 1682790846 ecr 92268551], length 977
12:26:05.926599 IP 151.101.193.140.https > arnab-lappy.41456: Flags [.], ack 1, win 63, options [nop,nop,TS val 1361357494 ecr 2753652061], length 0
12:26:05.927338 IP arnab-lappy.41424 > 151.101.193.140.https: Flags [.], ack 2969724191, win 1656, options [nop,nop,TS val 2754020708 ecr 523697415], length 0
12:26:05.928716 IP 151.101.193.140.https > arnab-lappy.41486: Flags [.], ack 1, win 68, options [nop,nop,TS val 1361357494 ecr 2753652596], length 0
12:26:05.928734 IP 151.101.193.140.https > arnab-lappy.41450: Flags [.], ack 1, win 88, options [nop,nop,TS val 523706974 ecr 2753652059], length 0
12:26:05.936834 IP ec2-54-179-187-46.ap-southeast-1.compute.amazonaws.com.https > arnab-lappy.59086: Flags [.], ack 524, win 110, options [nop,nop,TS val 318845759 ecr 4234161664], length 0
12:26:05.936875 IP ec2-54-179-187-46.ap-southeast-1.compute.amazonaws.com.https > arnab-lappy.59086: Flags [P.], seq 1:5303, ack 524, win 110, options [nop,nop,TS val 318845759 ecr 4234161664], length 5302
12:26:05.936894 IP arnab-lappy.59086 > ec2-54-179-187-46.ap-southeast-1.compute.amazonaws.com.https: Flags [.], ack 5303, win 474, options [nop,nop,TS val 4234161753 ecr 318845759], length 0
12:26:05.940193 IP arnab-lappy.59086 > ec2-54-179-187-46.ap-southeast-1.compute.amazonaws.com.https: Flags [P.], seq 524:650, ack 5303, win 501, options [nop,nop,TS val 4234161756 ecr 318845759], length 126
12:26:05.940250 IP 27.254.63.94.http > arnab-lappy.37742: Flags [R.], seq 1, ack 1, win 0, length 0
12:26:05.941741 IP arnab-lappy.59086 > ec2-54-179-187-46.ap-southeast-1.compute.amazonaws.com.https: Flags [P.], seq 650:1214, ack 5303, win 501, options [nop,nop,TS val 4234161758 ecr 318845759], length 564
12:26:05.946873 IP ec2-3-7-222-182.ap-south-1.compute.amazonaws.com.https > arnab-lappy.46036: Flags [.], ack 3049, win 132, options [nop,nop,TS val 92268565 ecr 1682790843], length 0
12:26:06.026216 IP ec2-3-7-222-182.ap-south-1.compute.amazonaws.com.https > arnab-lappy.46036: Flags [P.], seq 5522:6407, ack 3049, win 132, options [nop,nop,TS val 92268585 ecr 1682790843], length 885
12:26:06.027053 IP ec2-54-179-187-46.ap-southeast-1.compute.amazonaws.com.https > arnab-lappy.59086: Flags [P.], seq 5303:5577, ack 650, win 110, options [nop,nop,TS val 318845782 ecr 4234161756], length 274
12:26:06.027071 IP ec2-54-179-187-46.ap-southeast-1.compute.amazonaws.com.https > arnab-lappy.59086: Flags [P.], seq 5577:5646, ack 650, win 110, options [nop,nop,TS val 318845782 ecr 4234161756], length 69
12:26:06.027075 IP ec2-54-179-187-46.ap-southeast-1.compute.amazonaws.com.https > arnab-lappy.59086: Flags [P.], seq 5646:5684, ack 1214, win 114, options [nop,nop,TS val 318845782 ecr 4234161758], length 38
12:26:06.027080 IP ec2-54-179-187-46.ap-southeast-1.compute.amazonaws.com.https > arnab-lappy.59086: Flags [P.], seq 5684:5971, ack 1214, win 114, options [nop,nop,TS val 318845783 ecr 4234161758], length 287
12:26:06.027082 IP ec2-54-179-187-46.ap-southeast-1.compute.amazonaws.com.https > arnab-lappy.59086: Flags [P.], seq 5971:6009, ack 1214, win 114, options [nop,nop,TS val 318845783 ecr 4234161758], length 38
12:26:06.027969 IP arnab-lappy.59086 > ec2-54-179-187-46.ap-southeast-1.compute.amazonaws.com.https: Flags [.], ack 6009, win 501, options [nop,nop,TS val 4234161844 ecr 318845782], length 0
12:26:06.030202 IP arnab-lappy.59086 > ec2-54-179-187-46.ap-southeast-1.compute.amazonaws.com.https: Flags [P.], seq 1214:1252, ack 6009, win 501, options [nop,nop,TS val 4234161846 ecr 318845782], length 38
12:26:06.040970 IP arnab-lappy.49924 > ec2-13-127-25-52.ap-south-1.compute.amazonaws.com.https: Flags [.], seq 3286895569:3286896997, ack 3520890939, win 501, options [nop,nop,TS val 523779314 ecr 352663934], length 1428
12:26:06.042496 IP arnab-lappy.49924 > ec2-13-127-25-52.ap-south-1.compute.amazonaws.com.https: Flags [P.], seq 1428:1976, ack 1, win 501, options [nop,nop,TS val 523779316 ecr 352663934], length 548
12:26:06.071388 IP arnab-lappy.46036 > ec2-3-7-222-182.ap-south-1.compute.amazonaws.com.https: Flags [.], ack 6407, win 501, options [nop,nop,TS val 1682791022 ecr 92268585], length 0
12:26:06.090273 IP 151.101.193.140.https > arnab-lappy.41424: Flags [.], ack 1, win 146, options [nop,nop,TS val 523708718 ecr 2753791858], length 0
12:26:06.095461 IP ec2-13-127-25-52.ap-south-1.compute.amazonaws.com.https > arnab-lappy.49924: Flags [.], ack 1976, win 422, options [nop,nop,TS val 352668024 ecr 523779314], length 0
12:26:06.095483 IP ec2-13-127-25-52.ap-south-1.compute.amazonaws.com.https > arnab-lappy.49924: Flags [P.], seq 1:47, ack 1976, win 422, options [nop,nop,TS val 352668024 ecr 523779314], length 46
12:26:06.095498 IP arnab-lappy.49924 > ec2-13-127-25-52.ap-south-1.compute.amazonaws.com.https: Flags [.], ack 47, win 501, options [nop,nop,TS val 523779369 ecr 352668024], length 0
12:26:06.154304 IP ec2-54-179-187-46.ap-southeast-1.compute.amazonaws.com.https > arnab-lappy.59086: Flags [.], ack 1252, win 114, options [nop,nop,TS val 318845815 ecr 4234161846], length 0
12:26:06.248452 IP ec2-13-127-25-52.ap-south-1.compute.amazonaws.com.https > arnab-lappy.49924: Flags [P.], seq 47:4769, ack 1976, win 422, options [nop,nop,TS val 352668062 ecr 523779369], length 4722
12:26:06.248490 IP arnab-lappy.49924 > ec2-13-127-25-52.ap-south-1.compute.amazonaws.com.https: Flags [.], ack 4769, win 474, options [nop,nop,TS val 523779522 ecr 352668062], length 0
12:26:06.248501 IP ec2-13-127-25-52.ap-south-1.compute.amazonaws.com.https > arnab-lappy.49924: Flags [P.], seq 4769:4807, ack 1976, win 422, options [nop,nop,TS val 352668062 ecr 523779369], length 38
12:26:06.248505 IP arnab-lappy.49924 > ec2-13-127-25-52.ap-south-1.compute.amazonaws.com.https: Flags [.], ack 4807, win 474, options [nop,nop,TS val 523779522 ecr 352668062], length 0
12:26:06.564485 IP arnab-lappy.38883 > _gateway.domain: 3003+ [1au] PTR? 182.222.7.3.in-addr.arpa. (53)
12:26:06.798245 IP _gateway.domain > arnab-lappy.38883: 3003 1/0/1 PTR ec2-3-7-222-182.ap-south-1.compute.amazonaws.com. (115)
12:26:06.799267 IP arnab-lappy.37233 > _gateway.domain: 11859+ [1au] PTR? 46.187.179.54.in-addr.arpa. (55)
12:26:07.001712 IP _gateway.domain > arnab-lappy.37233: 11859 1/0/1 PTR ec2-54-179-187-46.ap-southeast-1.compute.amazonaws.com. (123)
12:26:07.463569 IP arnab-lappy.37732 > 27.254.63.94.http: Flags [P.], seq 3895212675:3895213365, ack 4044966314, win 3487, options [nop,nop,TS val 4005855781 ecr 588903134], length 690: HTTP: GET /Account.aspx HTTP/1.1
12:26:07.468331 IP arnab-lappy.33927 > bom07s15-in-f14.1e100.net.443: UDP, length 134
12:26:07.488120 IP arnab-lappy.47072 > bom05s11-in-f2.1e100.net.http: Flags [S], seq 591015953, win 64240, options [mss 1460,sackOK,TS val 1811774013 ecr 0,nop,wscale 7], length 0
12:26:07.538146 IP bom05s11-in-f2.1e100.net.http > arnab-lappy.47072: Flags [S.], seq 3370119132, ack 591015954, win 60192, options [mss 1380,sackOK,TS val 3889245782 ecr 1811774013,nop,wscale 8], length 0
12:26:07.538182 IP arnab-lappy.47072 > bom05s11-in-f2.1e100.net.http: Flags [.], ack 1, win 502, options [nop,nop,TS val 1811774063 ecr 3889245782], length 0
12:26:07.559154 IP bom07s15-in-f14.1e100.net.443 > arnab-lappy.33927: UDP, length 20
12:26:07.587994 IP arnab-lappy.39537 > _gateway.domain: 47025+ [1au] PTR? 66.196.58.216.in-addr.arpa. (55)
12:26:07.595362 IP bom07s15-in-f14.1e100.net.443 > arnab-lappy.33927: UDP, length 136
12:26:07.595850 IP bom07s15-in-f14.1e100.net.443 > arnab-lappy.33927: UDP, length 18
12:26:07.597267 IP arnab-lappy.33927 > bom07s15-in-f14.1e100.net.443: UDP, length 28
12:26:07.687320 IP _gateway.domain > arnab-lappy.39537: 47025 2/0/1 PTR bom05s11-in-f2.1e100.net., PTR kul01s09-in-f66.1e100.net. (123)
12:26:07.748354 IP arnab-lappy.50871 > bom05s15-in-f2.1e100.net.443: UDP, length 23
12:26:07.748399 IP arnab-lappy.48470 > bom05s15-in-f2.1e100.net.443: UDP, length 23
12:26:07.749504 IP arnab-lappy.44363 > bom12s03-in-f2.1e100.net.443: UDP, length 23
12:26:07.811382 IP arnab-lappy.46052 > bom07s01-in-f5.1e100.net.https: Flags [.], ack 2100854383, win 501, options [nop,nop,TS val 1071239740 ecr 2738285089], length 0
12:26:07.824536 IP bom05s15-in-f2.1e100.net.443 > arnab-lappy.50871: UDP, length 20
12:26:07.824560 IP bom05s15-in-f2.1e100.net.443 > arnab-lappy.48470: UDP, length 20
12:26:07.825781 IP bom12s03-in-f2.1e100.net.443 > arnab-lappy.44363: UDP, length 20
12:26:07.864541 IP bom07s01-in-f5.1e100.net.https > arnab-lappy.46052: Flags [.], ack 1, win 625, options [nop,nop,TS val 2738330395 ecr 1071149129], length 0
12:26:07.919727 IP 27.254.63.94.http > arnab-lappy.37732: Flags [.], ack 690, win 256, options [nop,nop,TS val 588904666 ecr 4005855781], length 0
12:26:07.968637 IP 27.254.63.94.http > arnab-lappy.37732: Flags [.], seq 1:4285, ack 690, win 256, options [nop,nop,TS val 588904671 ecr 4005855781], length 4284: HTTP: HTTP/1.1 200 OK
12:26:07.968658 IP arnab-lappy.37732 > 27.254.63.94.http: Flags [.], ack 4285, win 3554, options [nop,nop,TS val 4005856286 ecr 588904671], length 0
12:26:07.972935 IP 27.254.63.94.http > arnab-lappy.37732: Flags [.], seq 4285:27133, ack 690, win 256, options [nop,nop,TS val 588904671 ecr 4005855781], length 22848: HTTP
12:26:07.972973 IP arnab-lappy.37732 > 27.254.63.94.http: Flags [.], ack 27133, win 3469, options [nop,nop,TS val 4005856290 ecr 588904671], length 0
12:26:07.973041 IP 27.254.63.94.http > arnab-lappy.37732: Flags [.], seq 27133:29989, ack 690, win 256, options [nop,nop,TS val 588904671 ecr 4005855781], length 2856: HTTP
12:26:07.973047 IP arnab-lappy.37732 > 27.254.63.94.http: Flags [.], ack 29989, win 3450, options [nop,nop,TS val 4005856290 ecr 588904671], length 0
12:26:07.974352 IP 27.254.63.94.http > arnab-lappy.37732: Flags [.], seq 29989:38557, ack 690, win 256, options [nop,nop,TS val 588904671 ecr 4005855781], length 8568: HTTP
12:26:07.974392 IP arnab-lappy.37732 > 27.254.63.94.http: Flags [.], ack 38557, win 3561, options [nop,nop,TS val 4005856291 ecr 588904671], length 0
12:26:07.974459 IP 27.254.63.94.http > arnab-lappy.37732: Flags [.], seq 38557:39985, ack 690, win 256, options [nop,nop,TS val 588904671 ecr 4005855781], length 1428: HTTP
12:26:07.974465 IP arnab-lappy.37732 > 27.254.63.94.http: Flags [.], ack 39985, win 3552, options [nop,nop,TS val 4005856292 ecr 588904671], length 0
12:26:07.974918 IP 27.254.63.94.http > arnab-lappy.37732: Flags [.], seq 39985:41413, ack 690, win 256, options [nop,nop,TS val 588904671 ecr 4005855781], length 1428: HTTP
12:26:07.974933 IP arnab-lappy.37732 > 27.254.63.94.http: Flags [.], ack 41413, win 3584, options [nop,nop,TS val 4005856292 ecr 588904671], length 0
12:26:07.978367 IP 27.254.63.94.http > arnab-lappy.37732: Flags [.], seq 41413:48553, ack 690, win 256, options [nop,nop,TS val 588904671 ecr 4005855781], length 7140: HTTP
12:26:07.978387 IP arnab-lappy.37732 > 27.254.63.94.http: Flags [.], ack 48553, win 3570, options [nop,nop,TS val 4005856295 ecr 588904671], length 0
12:26:07.978772 IP 27.254.63.94.http > arnab-lappy.37732: Flags [.], seq 48553:51409, ack 690, win 256, options [nop,nop,TS val 588904671 ecr 4005855781], length 2856: HTTP
12:26:07.978786 IP arnab-lappy.37732 > 27.254.63.94.http: Flags [.], ack 51409, win 3598, options [nop,nop,TS val 4005856296 ecr 588904671], length 0
12:26:07.979229 IP 27.254.63.94.http > arnab-lappy.37732: Flags [.], seq 51409:55693, ack 690, win 256, options [nop,nop,TS val 588904671 ecr 4005855781], length 4284: HTTP
12:26:07.979242 IP arnab-lappy.37732 > 27.254.63.94.http: Flags [.], ack 55693, win 3589, options [nop,nop,TS val 4005856296 ecr 588904671], length 0
12:26:07.981632 IP 27.254.63.94.http > arnab-lappy.37732: Flags [.], seq 55693:61405, ack 690, win 256, options [nop,nop,TS val 588904671 ecr 4005855781], length 5712: HTTP
12:26:07.981648 IP arnab-lappy.37732 > 27.254.63.94.http: Flags [.], ack 61405, win 3580, options [nop,nop,TS val 4005856299 ecr 588904671], length 0
12:26:07.983527 IP 27.254.63.94.http > arnab-lappy.37732: Flags [.], seq 61405:62833, ack 690, win 256, options [nop,nop,TS val 588904671 ecr 4005855781], length 1428: HTTP
12:26:07.983549 IP arnab-lappy.37732 > 27.254.63.94.http: Flags [.], ack 62833, win 3607, options [nop,nop,TS val 4005856301 ecr 588904671], length 0
12:26:07.983564 IP 27.254.63.94.http > arnab-lappy.37732: Flags [.], seq 62833:64261, ack 690, win 256, options [nop,nop,TS val 588904671 ecr 4005855781], length 1428: HTTP
12:26:07.983569 IP arnab-lappy.37732 > 27.254.63.94.http: Flags [.], ack 64261, win 3598, options [nop,nop,TS val 4005856301 ecr 588904671], length 0
12:26:07.984015 IP 27.254.63.94.http > arnab-lappy.37732: Flags [.], seq 64261:68545, ack 690, win 256, options [nop,nop,TS val 588904671 ecr 4005855781], length 4284: HTTP
12:26:07.984025 IP arnab-lappy.37732 > 27.254.63.94.http: Flags [.], ack 68545, win 3589, options [nop,nop,TS val 4005856301 ecr 588904671], length 0
12:26:07.985061 IP 27.254.63.94.http > arnab-lappy.37732: Flags [.], seq 68545:74257, ack 690, win 256, options [nop,nop,TS val 588904671 ecr 4005855781], length 5712: HTTP
12:26:07.985077 IP arnab-lappy.37732 > 27.254.63.94.http: Flags [.], ack 74257, win 3580, options [nop,nop,TS val 4005856302 ecr 588904671], length 0
12:26:07.988003 IP 27.254.63.94.http > arnab-lappy.37732: Flags [.], seq 74257:81397, ack 690, win 256, options [nop,nop,TS val 588904671 ecr 4005855781], length 7140: HTTP
12:26:07.988027 IP arnab-lappy.37732 > 27.254.63.94.http: Flags [.], ack 81397, win 3570, options [nop,nop,TS val 4005856305 ecr 588904671], length 0
12:26:07.988387 IP 27.254.63.94.http > arnab-lappy.37732: Flags [.], seq 81397:87109, ack 690, win 256, options [nop,nop,TS val 588904671 ecr 4005855781], length 5712: HTTP
12:26:07.988403 IP arnab-lappy.37732 > 27.254.63.94.http: Flags [.], ack 87109, win 3580, options [nop,nop,TS val 4005856305 ecr 588904671], length 0
12:26:07.991786 IP 27.254.63.94.http > arnab-lappy.37732: Flags [.], seq 87109:99961, ack 690, win 256, options [nop,nop,TS val 588904671 ecr 4005855781], length 12852: HTTP
12:26:07.991807 IP arnab-lappy.37732 > 27.254.63.94.http: Flags [.], ack 99961, win 3533, options [nop,nop,TS val 4005856309 ecr 588904671], length 0
12:26:07.992873 IP 27.254.63.94.http > arnab-lappy.37732: Flags [.], seq 99961:104245, ack 690, win 256, options [nop,nop,TS val 588904671 ecr 4005855781], length 4284: HTTP
12:26:07.992896 IP arnab-lappy.37732 > 27.254.63.94.http: Flags [.], ack 104245, win 3589, options [nop,nop,TS val 4005856310 ecr 588904671], length 0
12:26:07.993166 IP 27.254.63.94.http > arnab-lappy.37732: Flags [.], seq 104245:105673, ack 690, win 256, options [nop,nop,TS val 588904671 ecr 4005855781], length 1428: HTTP
12:26:07.993175 IP arnab-lappy.37732 > 27.254.63.94.http: Flags [.], ack 105673, win 3607, options [nop,nop,TS val 4005856310 ecr 588904671], length 0
12:26:07.995032 IP 27.254.63.94.http > arnab-lappy.37732: Flags [.], seq 105673:112813, ack 690, win 256, options [nop,nop,TS val 588904671 ecr 4005855781], length 7140: HTTP
12:26:07.995108 IP arnab-lappy.37732 > 27.254.63.94.http: Flags [.], ack 112813, win 3607, options [nop,nop,TS val 4005856312 ecr 588904671], length 0
12:26:07.995629 IP 27.254.63.94.http > arnab-lappy.37732: Flags [.], seq 112813:114241, ack 690, win 256, options [nop,nop,TS val 588904671 ecr 4005855781], length 1428: HTTP
12:26:07.997134 IP 27.254.63.94.http > arnab-lappy.37732: Flags [.], seq 114241:119953, ack 690, win 256, options [nop,nop,TS val 588904671 ecr 4005855781], length 5712: HTTP
12:26:07.997180 IP arnab-lappy.37732 > 27.254.63.94.http: Flags [.], ack 119953, win 3607, options [nop,nop,TS val 4005856314 ecr 588904671], length 0
12:26:07.997591 IP 27.254.63.94.http > arnab-lappy.37732: Flags [.], seq 119953:124237, ack 690, win 256, options [nop,nop,TS val 588904671 ecr 4005855781], length 4284: HTTP
12:26:07.997623 IP arnab-lappy.37732 > 27.254.63.94.http: Flags [.], ack 124237, win 3607, options [nop,nop,TS val 4005856315 ecr 588904671], length 0
12:26:07.998455 IP arnab-lappy.38286 > bom05s15-in-f2.1e100.net.443: UDP, length 1171
12:26:07.998496 IP 27.254.63.94.http > arnab-lappy.37732: Flags [.], seq 124237:125665, ack 690, win 256, options [nop,nop,TS val 588904671 ecr 4005855781], length 1428: HTTP
12:26:07.999057 IP 27.254.63.94.http > arnab-lappy.37732: Flags [.], seq 125665:129949, ack 690, win 256, options [nop,nop,TS val 588904671 ecr 4005855781], length 4284: HTTP
12:26:07.999090 IP arnab-lappy.37732 > 27.254.63.94.http: Flags [.], ack 129949, win 3607, options [nop,nop,TS val 4005856316 ecr 588904671], length 0
12:26:07.999711 IP 27.254.63.94.http > arnab-lappy.37732: Flags [.], seq 129949:132805, ack 690, win 256, options [nop,nop,TS val 588904671 ecr 4005855781], length 2856: HTTP
12:26:07.999746 IP arnab-lappy.37732 > 27.254.63.94.http: Flags [.], ack 132805, win 3607, options [nop,nop,TS val 4005856317 ecr 588904671], length 0
12:26:08.001707 IP 27.254.63.94.http > arnab-lappy.37732: Flags [.], seq 132805:134233, ack 690, win 256, options [nop,nop,TS val 588904671 ecr 4005855781], length 1428: HTTP
12:26:08.002638 IP 27.254.63.94.http > arnab-lappy.37732: Flags [.], seq 134233:137089, ack 690, win 256, options [nop,nop,TS val 588904671 ecr 4005855781], length 2856: HTTP
12:26:08.002683 IP arnab-lappy.37732 > 27.254.63.94.http: Flags [.], ack 137089, win 3607, options [nop,nop,TS val 4005856320 ecr 588904671], length 0
12:26:08.003192 IP 27.254.63.94.http > arnab-lappy.37732: Flags [.], seq 137089:142801, ack 690, win 256, options [nop,nop,TS val 588904671 ecr 4005855781], length 5712: HTTP
12:26:08.003227 IP arnab-lappy.37732 > 27.254.63.94.http: Flags [.], ack 142801, win 3607, options [nop,nop,TS val 4005856320 ecr 588904671], length 0
12:26:08.005232 IP 27.254.63.94.http > arnab-lappy.37732: Flags [.], seq 142801:147085, ack 690, win 256, options [nop,nop,TS val 588904671 ecr 4005855781], length 4284: HTTP
12:26:08.005278 IP arnab-lappy.37732 > 27.254.63.94.http: Flags [.], ack 147085, win 3607, options [nop,nop,TS val 4005856322 ecr 588904671], length 0
12:26:08.007350 IP 27.254.63.94.http > arnab-lappy.37732: Flags [.], seq 147085:157081, ack 690, win 256, options [nop,nop,TS val 588904671 ecr 4005855781], length 9996: HTTP
12:26:08.007397 IP arnab-lappy.37732 > 27.254.63.94.http: Flags [.], ack 157081, win 3607, options [nop,nop,TS val 4005856324 ecr 588904671], length 0
12:26:08.007628 IP 27.254.63.94.http > arnab-lappy.37732: Flags [.], seq 157081:159937, ack 690, win 256, options [nop,nop,TS val 588904671 ecr 4005855781], length 2856: HTTP
12:26:08.007655 IP arnab-lappy.37732 > 27.254.63.94.http: Flags [.], ack 159937, win 3607, options [nop,nop,TS val 4005856325 ecr 588904671], length 0
12:26:08.009278 IP 27.254.63.94.http > arnab-lappy.37732: Flags [.], seq 159937:161365, ack 690, win 256, options [nop,nop,TS val 588904671 ecr 4005855781], length 1428: HTTP
12:26:08.009726 IP arnab-lappy.37712 > 27.254.63.94.http: Flags [P.], seq 2485851379:2485851943, ack 247103236, win 3704, options [nop,nop,TS val 4005856327 ecr 588903074], length 564: HTTP: GET /libs/jquery-1.11.0.min.js HTTP/1.1
12:26:08.010756 IP 27.254.63.94.http > arnab-lappy.37732: Flags [.], seq 161365:165649, ack 690, win 256, options [nop,nop,TS val 588904671 ecr 4005855781], length 4284: HTTP
12:26:08.010794 IP arnab-lappy.37732 > 27.254.63.94.http: Flags [.], ack 165649, win 3607, options [nop,nop,TS val 4005856328 ecr 588904671], length 0
12:26:08.011162 IP arnab-lappy.37908 > 27.254.63.94.http: Flags [S], seq 2779949642, win 64240, options [mss 1460,sackOK,TS val 4005856328 ecr 0,nop,wscale 7], length 0
12:26:08.011308 IP 27.254.63.94.http > arnab-lappy.37732: Flags [.], seq 165649:171361, ack 690, win 256, options [nop,nop,TS val 588904671 ecr 4005855781], length 5712: HTTP
12:26:08.012041 IP 27.254.63.94.http > arnab-lappy.37732: Flags [.], seq 171361:172789, ack 690, win 256, options [nop,nop,TS val 588904671 ecr 4005855781], length 1428: HTTP
12:26:08.012046 IP 27.254.63.94.http > arnab-lappy.37732: Flags [.], seq 199921:201349, ack 690, win 256, options [nop,nop,TS val 588904671 ecr 4005855781], length 1428: HTTP
12:26:08.012051 IP arnab-lappy.37732 > 27.254.63.94.http: Flags [.], ack 172789, win 3560, options [nop,nop,TS val 4005856329 ecr 588904671,nop,nop,sack 1 {199921:201349}], length 0
12:26:08.012455 IP arnab-lappy.37910 > 27.254.63.94.http: Flags [S], seq 2348825841, win 64240, options [mss 1460,sackOK,TS val 4005856330 ecr 0,nop,wscale 7], length 0
12:26:08.012514 IP arnab-lappy.37912 > 27.254.63.94.http: Flags [S], seq 1622350274, win 64240, options [mss 1460,sackOK,TS val 4005856330 ecr 0,nop,wscale 7], length 0
12:26:08.012570 IP arnab-lappy.37914 > 27.254.63.94.http: Flags [S], seq 1077374752, win 64240, options [mss 1460,sackOK,TS val 4005856330 ecr 0,nop,wscale 7], length 0
12:26:08.014396 IP 27.254.63.94.http > arnab-lappy.37732: Flags [.], seq 201349:207061, ack 690, win 256, options [nop,nop,TS val 588904671 ecr 4005855781], length 5712: HTTP
12:26:08.014406 IP arnab-lappy.37732 > 27.254.63.94.http: Flags [.], ack 172789, win 3570, options [nop,nop,TS val 4005856331 ecr 588904671,nop,nop,sack 1 {199921:207061}], length 0
12:26:08.015750 IP 27.254.63.94.http > arnab-lappy.37732: Flags [.], seq 207061:209917, ack 690, win 256, options [nop,nop,TS val 588904671 ecr 4005855781], length 2856: HTTP
12:26:08.015759 IP arnab-lappy.37732 > 27.254.63.94.http: Flags [.], ack 172789, win 3570, options [nop,nop,TS val 4005856333 ecr 588904671,nop,nop,sack 1 {199921:209917}], length 0
12:26:08.016388 IP 27.254.63.94.http > arnab-lappy.37732: Flags [.], seq 209917:212773, ack 690, win 256, options [nop,nop,TS val 588904671 ecr 4005855781], length 2856: HTTP
12:26:08.016394 IP arnab-lappy.37732 > 27.254.63.94.http: Flags [.], ack 172789, win 3570, options [nop,nop,TS val 4005856333 ecr 588904671,nop,nop,sack 1 {199921:212773}], length 0
12:26:08.016723 IP 27.254.63.94.http > arnab-lappy.37732: Flags [.], seq 212773:214201, ack 690, win 256, options [nop,nop,TS val 588904671 ecr 4005855781], length 1428: HTTP
12:26:08.016727 IP arnab-lappy.37732 > 27.254.63.94.http: Flags [.], ack 172789, win 3570, options [nop,nop,TS val 4005856334 ecr 588904671,nop,nop,sack 1 {199921:214201}], length 0
12:26:08.074408 IP bom05s15-in-f2.1e100.net.443 > arnab-lappy.38286: UDP, length 21
12:26:08.166061 IP bom05s15-in-f2.1e100.net.443 > arnab-lappy.38286: UDP, length 111
12:26:08.167740 IP bom05s15-in-f2.1e100.net.443 > arnab-lappy.38286: UDP, length 19
12:26:08.168072 IP arnab-lappy.38286 > bom05s15-in-f2.1e100.net.443: UDP, length 28
12:26:08.203270 IP 27.254.63.94.http > arnab-lappy.37732: Flags [.], seq 214201:221341, ack 690, win 256, options [nop,nop,TS val 588904695 ecr 4005856286], length 7140: HTTP
12:26:08.203321 IP arnab-lappy.37732 > 27.254.63.94.http: Flags [.], ack 172789, win 3570, options [nop,nop,TS val 4005856520 ecr 588904671,nop,nop,sack 1 {199921:221341}], length 0
12:26:08.204742 IP 27.254.63.94.http > arnab-lappy.37732: Flags [.], seq 221341:222769, ack 690, win 256, options [nop,nop,TS val 588904695 ecr 4005856286], length 1428: HTTP
12:26:08.204762 IP arnab-lappy.37732 > 27.254.63.94.http: Flags [.], ack 172789, win 3570, options [nop,nop,TS val 4005856522 ecr 588904671,nop,nop,sack 1 {199921:222769}], length 0
12:26:08.206792 IP 27.254.63.94.http > arnab-lappy.37732: Flags [.], seq 222769:228481, ack 690, win 256, options [nop,nop,TS val 588904695 ecr 4005856290], length 5712: HTTP
12:26:08.206811 IP arnab-lappy.37732 > 27.254.63.94.http: Flags [.], ack 172789, win 3570, options [nop,nop,TS val 4005856524 ecr 588904671,nop,nop,sack 1 {199921:228481}], length 0
12:26:08.207656 IP 27.254.63.94.http > arnab-lappy.37732: Flags [.], seq 228481:237049, ack 690, win 256, options [nop,nop,TS val 588904695 ecr 4005856290], length 8568: HTTP
12:26:08.207680 IP arnab-lappy.37732 > 27.254.63.94.http: Flags [.], ack 172789, win 3570, options [nop,nop,TS val 4005856525 ecr 588904671,nop,nop,sack 1 {199921:237049}], length 0
12:26:08.207916 IP 27.254.63.94.http > arnab-lappy.37732: Flags [.], seq 237049:239905, ack 690, win 256, options [nop,nop,TS val 588904695 ecr 4005856290], length 2856: HTTP
12:26:08.207935 IP arnab-lappy.37732 > 27.254.63.94.http: Flags [.], ack 172789, win 3570, options [nop,nop,TS val 4005856525 ecr 588904671,nop,nop,sack 1 {199921:239905}], length 0
12:26:08.208229 IP 27.254.63.94.http > arnab-lappy.37732: Flags [.], seq 239905:242761, ack 690, win 256, options [nop,nop,TS val 588904695 ecr 4005856290], length 2856: HTTP
12:26:08.208248 IP arnab-lappy.37732 > 27.254.63.94.http: Flags [.], ack 172789, win 3570, options [nop,nop,TS val 4005856525 ecr 588904671,nop,nop,sack 1 {199921:242761}], length 0
12:26:08.208595 IP 27.254.63.94.http > arnab-lappy.37732: Flags [.], seq 242761:245617, ack 690, win 256, options [nop,nop,TS val 588904695 ecr 4005856290], length 2856: HTTP
12:26:08.208615 IP arnab-lappy.37732 > 27.254.63.94.http: Flags [.], ack 172789, win 3570, options [nop,nop,TS val 4005856526 ecr 588904671,nop,nop,sack 1 {199921:245617}], length 0
12:26:08.209086 IP 27.254.63.94.http > arnab-lappy.37732: Flags [.], seq 245617:247045, ack 690, win 256, options [nop,nop,TS val 588904695 ecr 4005856290], length 1428: HTTP
12:26:08.209105 IP arnab-lappy.37732 > 27.254.63.94.http: Flags [.], ack 172789, win 3570, options [nop,nop,TS val 4005856526 ecr 588904671,nop,nop,sack 1 {199921:247045}], length 0
12:26:08.209332 IP 27.254.63.94.http > arnab-lappy.37732: Flags [.], seq 247045:248473, ack 690, win 256, options [nop,nop,TS val 588904695 ecr 4005856290], length 1428: HTTP
12:26:08.209353 IP arnab-lappy.37732 > 27.254.63.94.http: Flags [.], ack 172789, win 3570, options [nop,nop,TS val 4005856526 ecr 588904671,nop,nop,sack 1 {199921:248473}], length 0
12:26:08.209680 IP 27.254.63.94.http > arnab-lappy.37732: Flags [.], seq 248473:251329, ack 690, win 256, options [nop,nop,TS val 588904695 ecr 4005856290], length 2856: HTTP
12:26:08.209688 IP arnab-lappy.37732 > 27.254.63.94.http: Flags [.], ack 172789, win 3570, options [nop,nop,TS val 4005856527 ecr 588904671,nop,nop,sack 1 {199921:251329}], length 0
12:26:08.209947 IP 27.254.63.94.http > arnab-lappy.37732: Flags [.], seq 251329:252757, ack 690, win 256, options [nop,nop,TS val 588904695 ecr 4005856290], length 1428: HTTP
12:26:08.209954 IP arnab-lappy.37732 > 27.254.63.94.http: Flags [.], ack 172789, win 3570, options [nop,nop,TS val 4005856527 ecr 588904671,nop,nop,sack 1 {199921:252757}], length 0
12:26:08.210752 IP 27.254.63.94.http > arnab-lappy.37732: Flags [.], seq 252757:255613, ack 690, win 256, options [nop,nop,TS val 588904695 ecr 4005856290], length 2856: HTTP
12:26:08.210772 IP arnab-lappy.37732 > 27.254.63.94.http: Flags [.], ack 172789, win 3570, options [nop,nop,TS val 4005856528 ecr 588904671,nop,nop,sack 1 {199921:255613}], length 0
12:26:08.211198 IP 27.254.63.94.http > arnab-lappy.37732: Flags [.], seq 255613:257041, ack 690, win 256, options [nop,nop,TS val 588904695 ecr 4005856290], length 1428: HTTP
12:26:08.211217 IP arnab-lappy.37732 > 27.254.63.94.http: Flags [.], ack 172789, win 3570, options [nop,nop,TS val 4005856528 ecr 588904671,nop,nop,sack 1 {199921:257041}], length 0
12:26:08.211231 IP 27.254.63.94.http > arnab-lappy.37732: Flags [.], seq 257041:258469, ack 690, win 256, options [nop,nop,TS val 588904695 ecr 4005856292], length 1428: HTTP
12:26:08.211237 IP arnab-lappy.37732 > 27.254.63.94.http: Flags [.], ack 172789, win 3570, options [nop,nop,TS val 4005856528 ecr 588904671,nop,nop,sack 1 {199921:258469}], length 0
12:26:08.211423 IP arnab-lappy.34927 > bom05s15-in-f4.1e100.net.443: UDP, length 23
12:26:08.212527 IP 27.254.63.94.http > arnab-lappy.37732: Flags [.], seq 258469:262753, ack 690, win 256, options [nop,nop,TS val 588904695 ecr 4005856292], length 4284: HTTP
12:26:08.212547 IP arnab-lappy.37732 > 27.254.63.94.http: Flags [.], ack 172789, win 3570, options [nop,nop,TS val 4005856530 ecr 588904671,nop,nop,sack 1 {199921:262753}], length 0
12:26:08.212817 IP 27.254.63.94.http > arnab-lappy.37732: Flags [.], seq 262753:264181, ack 690, win 256, options [nop,nop,TS val 588904695 ecr 4005856292], length 1428: HTTP
12:26:08.212837 IP arnab-lappy.37732 > 27.254.63.94.http: Flags [.], ack 172789, win 3570, options [nop,nop,TS val 4005856530 ecr 588904671,nop,nop,sack 1 {199921:264181}], length 0
